,token_id,gloss,utterance_id,utterance_gloss,part_of_speech,log_frequency_bin,speaker_role,stanza_part_of_speech,stanza_morphology
723,61981264,good,16989208,Oatios in the bag sound good,adj,4,Mother,ADJ,Degree=Pos
724,62738647,things,17153150,that are doing things outside,n,4,Mother,NOUN,Number=Plur
725,62949761,dining,17201454,I'm gonna clean this dining room maybe we can sit in here,part,0,Mother,NOUN,Number=Sing
726,62049170,prosody,17000607,that's actually some prosody in this,n,0,Father,NOUN,Number=Sing
727,61834830,called,16941853,an he's called a dragonfly,part,4,Mother,VERB,Tense=Past|VerbForm=Part|Voice=Pass
728,61574883,foolish,16882315,and the foolish freight cars refused to back up,adj,1,Mother,ADJ,Degree=Pos
729,61274646,you,16791822,you would like to play with your potato head,pro,4,Mother,PRON,Case=Nom|Person=2|PronType=Prs
730,62287379,everybody,17048500,is that true for everybody,pro,2,Mother,PRON,Number=Sing
731,61663734,stuck,16913525,it's stuck,part,3,Mother,ADJ,Degree=Pos
732,61640530,scratch,16897362,scratch scratch,n,1,Mother,NOUN,Number=Sing
733,61386415,used,16817014,you you could've used your extra xxx at a Bob Stores xxx,part,2,Mother,VERB,Tense=Past|VerbForm=Part
734,62653128,utterly,17139005,utterly fabulous,adv,0,Mother,ADV,
735,62442923,against,17089646,I won't put it on you but I wanna hold it up against you,prep,1,Mother,ADP,
736,61850197,watched,16955799,Corduroy grew dizzy as he watched the clothes spinning round but the artist became inspired,v,1,Mother,VERB,Mood=Ind|Tense=Past|VerbForm=Fin
737,62587041,over,17116385,should I bring him over to you,adv,3,Mother,ADP,
738,62995620,to,17222620,to my room,prep,4,Mother,ADP,
739,62395229,meant,17076266,is'at watchoo meant by boring,v,2,Mother,VERB,Tense=Past|VerbForm=Part
740,61704401,with,16922500,no what are they those big pink birds with the skinny legs,prep,4,Mother,ADP,
741,61186384,green,16767082,yyy green,n,4,Target_Child,ADJ,Degree=Pos
742,62762331,shall,17163024,shall I help you open the top,mod,2,Mother,AUX,VerbForm=Fin
743,62357347,name,17062527,what's Babaji's daddy's name,n,4,Target_Child,NOUN,Number=Sing
744,61981306,shall,16989219,let's just check n make sure these are on shall we,mod,2,Mother,AUX,VerbForm=Fin
745,62821808,grow,17179382,in about twenty years or so it will grow into a tall oak tree that has many acorns,v,2,Mother,VERB,VerbForm=Inf
746,62522303,laddy,17103539,good morning laddy,adj,0,Target_Child,PUNCT,
747,62606037,hiding,17127123,you hiding while you were taping,part,3,Brother,VERB,VerbForm=Ger
748,62133001,potty,17010061,potty,adj,3,Target_Child,NOUN,Number=Sing
749,62756821,across,17159809,across the,adv,1,Target_Child,ADP,
750,62213970,out,17030978,hey the sun is out,adv,4,Mother,ADV,
751,62513591,mama,17104836,that's the mama where's the baby,n,3,Mother,NOUN,Number=Sing
752,62959959,dare,17214390,down by the bay where the watermelons grow back to my home I dare not go for if I do my mother will say,mod,1,Mother,AUX,Mood=Ind|Tense=Pres|VerbForm=Fin
753,62294375,making,17058002,it's making noise,part,4,Father,VERB,Tense=Pres|VerbForm=Part
754,61884758,doing,16949595,mm what are you doing,part,4,Mother,VERB,Tense=Pres|VerbForm=Part
755,62526495,everything,17102921,all can do is is we gotta get everything,pro,2,Target_Child,PRON,Number=Sing
756,61787423,other,16944221,put that other xxx and carry it,pro,1,Mother,ADJ,Degree=Pos
757,62486096,anyone,17094314,does Mary need to check anyone else,pro,1,Mother,PRON,Number=Sing
758,62320388,swallow,17059868,have some of your juice to help you swallow that egg,v,1,Mother,VERB,VerbForm=Inf
759,62742422,how,17158874,okay how about,pro,3,Mother,SCONJ,PronType=Int
760,62334323,flush,17063217,would you like to get it out of the diaper and flush it down the toilet,adv,1,Mother,VERB,VerbForm=Inf
761,62680667,whichever,17143008,uh whichever one I don't care,pro,0,Mother,DET,PronType=Int
762,62840679,costume,17174662,she's in a costume isn't she for Halloween,n,2,Mother,NOUN,Number=Sing
763,62676409,immediately,17140754,but they can swim and dive almost immediately after birth,adv,1,Mother,ADV,
764,63035820,little,17230619,yeah this is our small little pink ball,adj,4,Sister,ADJ,Degree=Pos
765,62120476,whiny,17023728,what's the matter whiny girl,adj,0,Father,ADJ,Degree=Pos
766,62531778,wakie,17107669,are they wakie wakie,v,0,Mother,PUNCT,
767,61788200,swim,16946282,I can swim,v,2,Target_Child,VERB,VerbForm=Inf
768,62494426,peeling,17095899,no I was actually peeling them,part,2,Mother,VERB,Tense=Pres|VerbForm=Part
769,61542800,how,16860567,how about Sarasponda_Sarasponda_Sarasponda_Ret_Set_Set,pro,3,Mother,ADV,PronType=Int
770,61539229,second,16870700,when Gordon was repaired again he took Sir Topham Hatt to the new station for its second official opening,adj,2,Mother,ADJ,Degree=Pos|NumType=Ord
771,61229868,big,16782281,lookit look how big the play+dough's getting xxx so big,adj,4,Mother,ADJ,Degree=Pos
772,61292531,called,16794234,what's that called,part,4,Mother,VERB,Tense=Past|VerbForm=Part
773,62334613,separately,17059918,I could make some separately for your dad nonwholewheat pasta,adv,0,Mother,ADV,
774,61832039,who,16947836,who was it,pro,3,Target_Child,PRON,PronType=Int
775,62669291,what,17135279,your wearing a backpack on the back and what on the front,pro,4,Father,PRON,PronType=Int
776,61668712,silly,16901854,you are silly,adj,3,Mother,ADJ,Degree=Pos
777,62521580,way,17102084,oh so I better move out of the way huh,n,4,Mother,NOUN,Number=Sing
778,61753278,since,16920653,and since winter was not far off,prep,1,Mother,SCONJ,
779,61732214,of,16920461,perhaps a painting of swiss cheese and crackers or a statue,prep,4,Mother,ADP,
780,62586893,worrying,17115895,so he he's he's he's worrying cause he wants to see his doctor,part,0,Target_Child,VERB,Tense=Pres|VerbForm=Part
781,62083418,declined,17007950,but they never told us that it was declined,part,0,Investigator,VERB,Tense=Past|VerbForm=Part|Voice=Pass
782,61966646,jeweled,16975356,Snow White's world Snow White lives in an enchanted land with seven jeweled hills and seven waterfalls,adj,0,Mother,ADJ,Degree=Pos
783,62801558,all,17174440,it's all gone sweetie,adv,4,Mother,ADV,
784,62354798,Murphy,17066187,Sergeant Murphy,n,2,Mother,PROPN,Number=Sing
785,61529807,house,16875120,should they go up into their fire house,n,4,Mother,NOUN,Number=Sing
786,61589407,what,16885959,isn't that what Kipper did,pro,4,Mother,PRON,PronType=Int
787,62576156,till,17106156,I can just ride it out till then,v,0,Mother,ADP,
788,61794744,red,16936217,red,adj,4,Target_Child,ADJ,Degree=Pos
789,61581031,back,16889071,it's a hand with three fingers let's see if we can stick it back in,adj,3,Mother,ADV,
790,61791871,name,16934574,but we don't even know his name began Mr Brown,n,4,Mother,NOUN,Number=Sing
791,61589635,canister,16883821,canister,n,0,Target_Child,NOUN,Number=Sing
792,61785907,downstairs,16946613,Maisy runs downstairs to see who it is who do you think's at the door,adv,2,Mother,ADV,
793,61803672,during,16934459,do you think the spider goes to school during the day,prep,1,Mother,ADP,
794,62336979,related,17064928,did you know eagles are related to dinosaurs Naima,part,1,Father,ADJ,Degree=Pos
795,62460234,eat,17086376,hey do you wanna sit up here and eat,v,4,Father,VERB,VerbForm=Inf
796,62737434,happily,17144637,and soon starts laughing happily,adv,1,Mother,ADV,
797,62211093,she,17041843,yeah she run well no but she runs that childrens' place,pro,3,Mother,PRON,Case=Nom|Gender=Fem|Number=Sing|Person=3|PronType=Prs
798,62086605,clip,16998190,do you let me clip this on so it doesn't break okay,v,2,Mother,VERB,VerbForm=Inf
799,62531098,going,17103792,this bear is going to sit in this rocking chair,part,4,Target_Child,VERB,Tense=Pres|VerbForm=Part
800,62064085,underwater,16991811,I dove underwater to rescue him and I was able to pull him to shore,adv,1,Mother,ADJ,Degree=Pos
801,62975878,over,17219150,come on over to the table,adv,3,Mother,ADV,
802,62385841,poor,17076405,xxx yyy poor mister fly doesn't want to bite,adj,2,Target_Child,ADJ,Degree=Pos
803,62808663,it,17176788,you got it babe,pro,4,Grandmother,PRON,Case=Acc|Gender=Neut|Number=Sing|Person=3|PronType=Prs
804,61799599,whom,16946039,so Mr Brown marked up three squares and to make it more exciting he said he would give a price to whom ever had the best idea,pro,0,Mother,PRON,PronType=Rel
805,62837769,in,17183904,oh you want me to put your sock in my hand,prep,4,Mother,ADP,
806,62111852,sit,17006936,Sleepy Bear's gonna sit on my lap,v,3,Mother,VERB,VerbForm=Inf
807,61519043,clear,16867337,the road it's very clear,adv,1,Target_Child,ADJ,Degree=Pos
808,62901157,to,17193505,now right now I'll xxx go down to uh to pick up that type of gasket see if I can get one of those gaskets,prep,4,Visitor,ADP,
809,62771023,sorry,17164447,I know I'm sorry,adj,3,Father,ADJ,Degree=Pos
810,61539311,different,16870943,or you want a different different one,adj,3,Mother,ADJ,Degree=Pos
811,61838153,ought,16951031,the shortcut led right to where Harold thought a forest ought to be,mod,1,Mother,AUX,VerbForm=Fin
812,62306438,Mommy,17046726,yyy Mommy Mommy trying to do,n,4,Target_Child,PROPN,Number=Sing
813,62472125,we,17088750,we could put two of these together to make his desk,pro,4,Mother,PRON,Case=Nom|Number=Plur|Person=1|PronType=Prs
814,61502363,from,16870662,that's a design from your shoe,prep,3,Mother,ADP,
815,62829754,dare,17182674,back to my home I dare not go,mod,1,Mother,AUX,Mood=Ind|Tense=Pres|VerbForm=Fin
816,62391392,realize,17073919,he doesn't realize that he's putting all his presents on fire,v,1,Mother,VERB,VerbForm=Inf
817,61183259,want,16761495,I want this,v,4,Target_Child,VERB,Mood=Ind|Tense=Pres|VerbForm=Fin
818,62203133,pole,17032112,and I'm putting the holes on the pole,n,2,Mother,NOUN,Number=Sing
819,62766174,pipe,17156682,pipe fish,n,1,Mother,NOUN,Number=Sing
820,62612001,coming,17118811,how's the pizza coming,part,4,Mother,VERB,Tense=Pres|VerbForm=Part
821,62081111,can,17000395,well we can't see it now but we can see it another day or we could look at some old ones later,mod,4,Mother,AUX,VerbForm=Fin
822,62736131,his,17150315,yyy and he's sliding on his,pro,1,Target_Child,PRON,Gender=Masc|Number=Sing|Person=3|Poss=Yes|PronType=Prs
823,62495245,stupid,17100975,stupid thing can't get it shut,adj,2,Mother,ADJ,Degree=Pos
824,62316941,chair,17050704,that's in front of the chair there's another one at the back of the chair,n,3,Father,NOUN,Number=Sing
825,61310188,silky,16817717,stroke my soft silky fur,adj,0,Mother,ADJ,Degree=Pos
826,61833477,shall,16949483,shall I get you some sandals honey,mod,2,Mother,AUX,VerbForm=Fin
827,61927402,might,16970535,if I looked grey I think I might be sick,mod,3,Mother,AUX,VerbForm=Fin
828,61623522,going,16892862,the lamb's going inside,n,2,Mother,VERB,Tense=Pres|VerbForm=Part
829,61237244,good,16784203,how are the fish are they good,adj,4,Mother,ADJ,Degree=Pos
830,62191684,Becky,17016768,my name is Becky and I live near the New_York public library,n,0,Mother,PROPN,Number=Sing
831,61198180,Gigi,16777785,Alex Gigi is talking to you,n,3,Mother,PROPN,Number=Sing
832,62246277,various,17038293,have various ideas about what the opposite is or whether it has one,adj,0,Mother,ADJ,Degree=Pos
833,61405792,dog,16842375,no dog on that,n,3,Target_Child,NOUN,Number=Sing
834,61675427,pooping,16903966,poop xxx is the skunk pooping,part,2,Mother,NOUN,Number=Sing
835,62104691,shocking,17006420,shocking,part,1,Target_Child,ADJ,Degree=Pos
836,62250537,ping,17039968,ping bing ping pengams,v,1,Target_Child,NOUN,Number=Sing
837,61996746,eating,16988020,these cats were carnivores or meat eaters and use their sharp xxx sharp teeth to pierce the thick skins of the plant eating animals,part,4,Mother,VERB,VerbForm=Ger
838,61181793,may,16776741,may I have some yellow play+dough,mod,3,Mother,AUX,VerbForm=Fin
839,62988572,you,17224354,you said you wanted to go for a bike ride,pro,4,Mother,PRON,Case=Nom|Person=2|PronType=Prs
840,62753306,rewarded,17161672,quite a trick he thought as he rewarded the elephant with a big peanut,v,0,Mother,VERB,Mood=Ind|Tense=Past|VerbForm=Fin
841,62885691,tight,17200596,xxx too tight,adv,2,Target_Child,ADJ,Degree=Pos
842,62884408,bloom,17199045,but it still kept snowing and the lakes didn't thaw and the birds failed to build their nests and the flowers didn't bloom,v,0,Mother,VERB,VerbForm=Inf
843,62010272,staying,16997716,you having trouble staying on the chair,part,2,Mother,VERB,VerbForm=Ger
844,61570812,here,16888772,oh we're falling apart here Ethan huh,pro,0,Mother,ADV,PronType=Dem
845,62737964,streaming,17146212,streaming up the sky,part,0,Mother,VERB,VerbForm=Ger
846,62841648,on,17179101,come on,adv,4,Mother,ADP,
847,62489539,name,17092540,the way Wodney says his name,n,4,Mother,NOUN,Number=Sing
848,62726767,match,17155911,match up the picture,v,2,Mother,VERB,Mood=Imp|VerbForm=Fin
849,62842918,underneath,17181265,underneath him like this,prep,2,Mother,VERB,Mood=Imp|VerbForm=Fin
850,61674310,dancing,16921552,are you dancing,part,3,Mother,VERB,Tense=Pres|VerbForm=Part
851,62036235,can,16987382,you can always tell him because he's always,mod,4,Father,AUX,VerbForm=Fin
852,62805336,today,17164312,who was at school today,adv,3,Mother,NOUN,Number=Sing
853,62494282,all,17095640,why are there all different brushes,adv,4,Target_Child,DET,
854,62276577,soaping,17050160,soaping,part,0,Target_Child,NOUN,Number=Sing
855,62125008,meow,17016475,meow meow meow meow meow,v,3,Target_Child,NOUN,Number=Sing
856,62874054,may,17196006,you may have red hands for a long time kiddo,mod,3,Mother,AUX,VerbForm=Fin
857,62715536,here,17150397,this page over here,n,4,Mother,ADV,PronType=Dem
858,62367248,why,17071630,you just don't want Mommy using the computer is that why you're upset,pro,3,Mother,SCONJ,PronType=Int
859,61819017,near,16945149,after tea that sat in the big purple chair near the window and waited for snow,prep,2,Mother,ADP,
860,61660584,does,16903009,xxx what does he have,v,3,Mother,AUX,Mood=Ind|Number=Sing|Person=3|Tense=Pres|VerbForm=Fin
861,62199227,safely,17038095,safely to abide,adv,1,Mother,ADV,
862,61947304,Hilda,16972471,oh boy Hilda Hippo,n,2,Mother,PROPN,Number=Sing
863,61820555,beneath,16948359,and the bough of the ship pierced her cold heart slowly the horrible sea witch sank beneath the waves forever,prep,1,Mother,ADP,
864,61329129,before,16819581,okay what comes before let's see,prep,2,Mother,SCONJ,
865,62059112,definitely,17002639,definitely trees outside,adv,2,Mother,ADV,
866,61637041,none,16902831,this little piggy had none,pro,1,Mother,NOUN,Number=Sing
867,61539377,so,16871071,Blue's school is so big,adv,4,Mother,ADV,
868,62850048,do,17186547,oh what do you say,mod,4,Mother,AUX,Mood=Ind|Tense=Pres|VerbForm=Fin
869,62543760,nutty,17098240,xxx why is that no this is not pretty nutty,adj,1,Target_Child,ADJ,Degree=Pos
870,62090099,well,17008712,well now,adv,3,Mother,INTJ,
871,62863881,inside,17186869,yes I think you're I think you're a good soccer player I just don't think it's an appropriate game for inside the house,prep,2,Mother,ADP,
872,62555085,November,17101457,today is November,n,1,Mother,PROPN,Number=Sing
873,61212264,almost,16782671,almost looks like a moon,adv,3,Mother,ADV,
874,61582676,down,16873092,your pants are falling down huh,prep,3,Mother,ADV,
875,61714807,in,16925924,ooh look at this book we haven't read this in a long time,prep,4,Mother,ADP,
876,62800270,through,17169088,all through the town,prep,3,Mother,ADP,
877,62506263,picture,17083597,you gonna hold the handle of the stroller to show that you're strolling him in the picture,n,4,Mother,NOUN,Number=Sing
878,61230304,cinnamon,16784274,cloves cinnamon ginger baking soda,n,1,Mother,NOUN,Number=Sing
879,61291067,today,16794465,no squirrels today,adv,3,Mother,NOUN,Number=Sing
880,62776790,airborne,17168811,yyy snakes are fun xxx airborne snakes yyy yyy,adj,0,Target_Child,ADJ,Degree=Pos
881,62650617,gotta,17131136,mama we gotta go out the farm,mod,3,Target_Child,AUX,VerbForm=Fin
882,62671445,gotta,17141571,xxx wait wait you gotta wait until I fill it up,mod,3,Mother,AUX,VerbForm=Fin
883,61474810,gonna,16858632,it's gonna go,part,4,Mother,PART,
884,62695697,gotta,17141979,gotta keep that on,mod,3,Mother,AUX,VerbForm=Fin
885,61508802,cannot,16866968,I cannot I cannot I,mod,2,Target_Child,AUX,VerbForm=Fin
886,62154470,how're,17026726,hi I'm fine how're you,pro,0,Mother,ADP,
887,61991771,thirteen,16976085,the thirteen women put on different kinds of complicated underwear,det,1,Mother,NUM,NumType=Card
888,61240098,eights,16781180,where's your eights,det,0,Mother,NOUN,Number=Plur
889,62823719,nineteen,17179814,the giraffe is the tallest animal on Earth it can grow to be nineteen feet tall,det,1,Mother,NUM,NumType=Card
890,61200995,eight,16773244,two three four five six seven eight nine,det,2,Target_Child,NUM,NumType=Card
891,61200993,six,16773244,two three four five six seven eight nine,det,2,Target_Child,NUM,NumType=Card
892,62375966,a,17064456,you have a naked arm and an arm with a shirt on it,det,4,Mother,DET,Definite=Ind|PronType=Art
893,61911463,thousands,16961335,and everywhere thousands of folks flocked to see and laugh at the elephant up in a tree,det,0,Mother,NOUN,Number=Plur
894,61994735,hundreds,16979889,there he can be seen very clearly by the one hundred and four people on the stage and by the hundreds of people in the audience,det,0,Mother,NOUN,Number=Plur
895,62652398,that,17137546,look at that big fat belly,det,3,Mother,DET,Number=Sing|PronType=Dem
896,62705672,ten,17151388,ten makes a celebration loud loud loud,det,2,Mother,NUM,NumType=Card
897,62195769,a,17026803,a prancing yyy a,det,4,Target_Child,DET,Definite=Ind|PronType=Art
898,62293185,what,17046899,like a what like a musketeer,det,0,Mother,PRON,PronType=Int
899,62697937,seventeen,17138834,fifteen forks sixteen marbles seventeen pencil sharpeners eighteen umbrellas nineteen shelves,det,1,Mother,NUM,NumType=Card
900,62697940,eighteen,17138834,fifteen forks sixteen marbles seventeen pencil sharpeners eighteen umbrellas nineteen shelves,det,1,Mother,NUM,NumType=Card
901,61286749,these,16797612,how bout these eyes,det,3,Mother,DET,Number=Plur|PronType=Dem
902,62342101,hundreds,17060745,next door in Candy's corner window were hundreds of vampire teeth,det,0,Mother,NOUN,Number=Plur
903,61217383,eight,16782621,yyy a eight,det,2,Target_Child,NUM,NumType=Card
904,61482808,my,16856601,from my engine shiny and black,det,3,Mother,PRON,Number=Sing|Person=1|Poss=Yes|PronType=Prs
905,61625116,the,16896517,shi buckle Birthday_Bear on the other side,det,4,Mother,DET,Definite=Def|PronType=Art
906,61996055,seventies,16985309,that's my birth decade we're back in the seventies,det,0,Mother,NOUN,Number=Plur
907,61889955,zero,16966310,it's zero,det,1,Mother,ADJ,Degree=Pos
908,62295530,nineteen,17050843,Naima is nineteen months old,det,1,Mother,NUM,NumType=Card
909,62286527,a,17054850,because the circus is a fun thing to see,det,4,Mother,DET,Definite=Ind|PronType=Art
910,62665587,millions,17129954,millions of stars twinkle in the night sky,det,0,Mother,NOUN,Number=Plur
911,62598852,three,17111525,one two three books,det,3,Target_Child,NUM,NumType=Card
912,61578531,the,16884919,the island of Sodor ambulance,det,4,Mother,DET,Definite=Def|PronType=Art
913,62522425,zero,17103958,well not zero nursing but you didn't wake up to nurse until four thirty,det,1,Mother,ADJ,Degree=Pos
914,62704731,a,17144263,xxx read me a book,det,4,Target_Child,DET,Definite=Ind|PronType=Art
915,62102793,her,17010890,we played soccer at her house,det,3,Mother,PRON,Gender=Fem|Number=Sing|Person=3|Poss=Yes|PronType=Prs
916,62182107,my,17026093,actually you know what I can put them on my nails my finger nails,det,3,Mother,PRON,Number=Sing|Person=1|Poss=Yes|PronType=Prs
917,62086655,one,16998361,no one has Shark Tale yet it's just in the movie theater,det,3,Mother,NOUN,Number=Sing
918,62682834,fourteen,17141970,fourteen seven flies with fourteen eyes,det,1,Mother,NUM,NumType=Card
919,62952649,the,17209191,mm okay now I'm gonna heat the pan up okay,det,4,Mother,DET,Definite=Def|PronType=Art
920,61346861,fours,16805322,no fours over there in the other bed,det,0,Mother,NOUN,Number=Plur
921,62974767,this,17210794,can you lift this one up,det,4,Mother,DET,Number=Sing|PronType=Dem
922,62587022,the,17116339,I'm the doctor and I'm seeing another patient,det,4,Target_Child,DET,Definite=Def|PronType=Art
923,62578201,seventeen,17110062,there was a very bad blizzard almost this bad seventeen years ago,det,1,Father,NUM,NumType=Card
924,61583574,zillion,16876895,a zillion eyes,det,0,Target_Child,ADJ,Degree=Pos
925,62332174,twenty,17058400,this salsa only has twenty one,det,2,Mother,NUM,NumType=Card
926,61231058,eight,16784421,eight yyy yyy yyy,det,2,Target_Child,NUM,NumType=Card
927,62262226,his,17052940,Max took the crown and wig off Rapunzel and put them on his spider xxx,det,3,Mother,PRON,Gender=Masc|Number=Sing|Person=3|Poss=Yes|PronType=Prs
928,62733751,thirty,17157370,one thirty four,det,2,Mother,NUM,NumType=Card
929,62408581,the,17084908,does the bear want more of the plain kind of yogurt,det,4,Mother,DET,Definite=Def|PronType=Art
930,62367804,this,17073090,turn this microphone off,det,4,Mother,DET,Number=Sing|PronType=Dem
931,62345616,the,17068595,those that part of the snowplow pushes the snow,det,4,Mother,DET,Definite=Def|PronType=Art
932,62821482,thousands,17178454,these changes takes hundreds of thousands of years oceans rise up covering parts of the land sheets of ice called glaciers move and carry rocks and dirt with them,det,0,Mother,NOUN,Number=Plur
933,62265038,a,17042073,xxx ma make a yyy,det,4,Target_Child,DET,Definite=Ind|PronType=Art
934,61550385,nine,16881110,nine,det,2,Media,NUM,NumType=Card
935,61775796,fours,16938092,I think by the time September starts we'll be like we should have done three or fours mornings a week,det,0,Mother,NOUN,Number=Plur
936,61528223,the,16871851,way far away from the bridge and the crack and the track,det,4,Mother,DET,Definite=Def|PronType=Art
937,61894230,thousands,16959170,um beetles eat all kinds of plants and animals and there are thousands of different beetles living everywhere,det,0,Mother,NOUN,Number=Plur
938,61578822,twelve,16888061,twelve,det,2,Mother,NUM,NumType=Card
939,61316093,your,16819316,you want your kitty+cat,det,4,Mother,PRON,Person=2|Poss=Yes|PronType=Prs
940,61276497,this,16796741,oh what is this going on this track,det,4,Mother,DET,Number=Sing|PronType=Dem
941,61180093,eight,16763842,one two three four five six seven eight nine ten eleven twelve,det,2,Mother,NUM,NumType=Card
942,61358682,million,16823362,and a million million million million million bumps,det,1,Mother,NUM,NumType=Card
943,62046786,ones,17002713,and the other ones and the other and the black rubber bands keep you safe,det,2,Target_Child,NOUN,Number=Plur
944,61329181,nineteen,16819960,nineteen,det,1,Mother,NUM,NumType=Card
945,61903098,my,16953147,my mom's making me get rid of these she said sadly oh boy cool cat comics said Arthur,det,3,Mother,PRON,Number=Sing|Person=1|Poss=Yes|PronType=Prs
946,62578275,a,17110139,if you wore the microphone on your shirt we would have a very good recording,det,4,Father,DET,Definite=Ind|PronType=Art
947,62404120,an,17072995,that bird is an albatross,det,3,Target_Child,DET,Definite=Ind|PronType=Art
948,62855523,its,17185557,this puzzle its,det,2,Mother,PRON,Gender=Neut|Number=Sing|Person=3|Poss=Yes|PronType=Prs
949,61869481,a,16957241,and a um a crocodile,det,4,Target_Child,DET,Definite=Ind|PronType=Art
950,62405464,three,17075253,one two three four five six seven eight,det,3,Target_Child,NUM,NumType=Card
951,61211774,six,16780190,say six,det,2,Mother,NUM,NumType=Card
952,61984863,a,16971695,I'll get not a big one,det,4,Target_Child,DET,Definite=Ind|PronType=Art
953,62511541,the,17087935,so if the vacuum+cleaner had a round shape do you think she would still be afraid of it,det,4,Mother,DET,Definite=Def|PronType=Art
954,62763171,fourteen,17164805,fourteen dollars,det,1,Mother,NUM,NumType=Card
955,61236214,fives,16778289,that's a whole bunch of fives,det,0,Mother,NOUN,Number=Plur
956,61441379,fourteen,16848456,yyy fourteen,det,1,Target_Child,NUM,NumType=Card
957,62692327,eight,17142990,so it was eight thirty ta to two thirty,det,2,Mother,NUM,NumType=Card
958,61809469,an,16941531,you've got an olive on your finger,det,3,Mother,DET,Definite=Ind|PronType=Art
959,62412517,two,17082461,use two hands for that,det,3,Mother,NUM,NumType=Card
960,62027068,trillion,16983477,the solar system was once a cloud of dust and gas that stretched for more than a trillion miles,det,0,Mother,NUM,NumType=Card
961,62188433,the,17030100,and how about the little elephant,det,4,Mother,DET,Definite=Def|PronType=Art
962,61330022,forty,16824256,the record is six let's play forty five seconds starts now,det,1,Media,NUM,NumType=Card
963,62742804,ninety,17160005,for a dollar ninety nine is that a lot,det,1,Brother,NUM,NumType=Card
964,62277237,this,17051978,okay but I'm gonna take care of this water first,det,4,Mother,DET,Number=Sing|PronType=Dem
965,61182631,nine,16763337,xxx nine nine,det,2,Mother,NUM,NumType=Card
966,61343337,thirteen,16826423,thirteen I think I can do thirteen,det,1,Mother,NUM,NumType=Card
967,62235460,ones,17040210,you want the other ones okay,det,2,Mother,NOUN,Number=Plur
968,62366453,nine,17060456,nine cows,det,2,Target_Child,NUM,NumType=Card
969,61351112,thirteen,16811676,uh what's that a dog and a yyy thirteen,det,1,Target_Child,NUM,NumType=Card
970,61340550,two,16823201,two hats Mom,det,3,Target_Child,NUM,NumType=Card
971,61766651,his,16931131,and his snappy cap flew off,det,3,Mother,PRON,Gender=Masc|Number=Sing|Person=3|Poss=Yes|PronType=Prs
972,62622078,six,17125742,one two three four five six seven eight,det,2,Mother,NUM,NumType=Card
973,61562635,my,16884219,oh my gosh,det,3,Mother,INTJ,
